{
  "$schema": "https://json-schema.org/draft/2020-12/schema",
  "$id": "schemas/EconomyConfig.schema.json",
  "title": "EconomyConfig",
  "type": "object",
  "additionalProperties": false,
  "required": [
    "dropCoinP0", "dropCoinPMax",
    "dropShardP0", "dropShardPMax",
    "dropCardP0", "dropCardPMax",
    "superNeedlePBase", "superNeedlePMin", "superNeedlePCap",
    "gaugeA", "gaugeB", "gaugeC",
    "gaugeCarryFail",
    "pGamma", "pQualityCoef"
  ],
  "properties": {
    "dropCoinP0": { "type": "number", "default": 0.22 },
    "dropCoinPMax": { "type": "number", "default": 0.55 },

    "dropShardP0": { "type": "number", "default": 0.04 },
    "dropShardPMax": { "type": "number", "default": 0.12 },

    "dropCardP0": { "type": "number", "default": 0.015 },
    "dropCardPMax": { "type": "number", "default": 0.04 },

    "superNeedlePBase": { "type": "number", "default": 0.008 },
    "superNeedlePMin": { "type": "number", "default": 0.003 },
    "superNeedlePCap": { "type": "number", "default": 0.05 },

    "gaugeA": { "type": "number", "default": 0.035 },
    "gaugeB": { "type": "number", "default": 0.03 },
    "gaugeC": { "type": "number", "default": 0.02 },

    "gaugeCarryFail": { "type": "number", "default": 0.2 },

    "pGamma": { "type": "number", "default": 0.5 },
    "pQualityCoef": { "type": "number", "default": 0.25 }
  }
}
